<?xml version="1.0" encoding="UTF-8"?>

<persons 
xmlns:xsi="http://www.w3.org/2001/XMLSchema-instance"
xsi:noNamespaceSchemaLocation="newXmlSchema.xsd"
>

<person lang="PP">
  <firstname>Hege</firstname>
  <lastname>Refsnes</lastname>
  <children>
    <childname>Cecilie</childname>
  </children>
</person>

<person>
  <firstname>Stale</firstname>
  <lastname>Refsnes</lastname>
</person>

</persons>
